<UrlHelperTest xmlns:xsi="http://www.w3.org/2001/XMLSchema-instance" xsi:noNamespaceSchemaLocation="./UrlHelperTest.xsd">
    <TestData Value="" Description="Empty String">
        <Windows>
            <FsPathRegex Success="true">
                <Group Name="a" Success="false" />
                <Group Name="h" Success="false" />
                <Group Name="p" Success="true"></Group>
            </FsPathRegex>
            <FsPathPattern Success="false" />
            <FormatGuess Success="false" />
            <FileUriStrict Success="true">
                <Group Name="a" Success="false" />
                <Group Name="h" Success="false" />
                <Group Name="p" Success="true"></Group>
            </FileUriStrict>
        </Windows>
        <Linux>
            <FsPathRegex Success="true">
                <Group Name="a" Success="false" />
                <Group Name="h" Success="false" />
                <Group Name="p" Success="true"></Group>
            </FsPathRegex>
            <FsPathPattern Success="false" />
            <FormatGuess Success="false" />
            <FileUriStrict Success="true">
                <Group Name="a" Success="false" />
                <Group Name="h" Success="false" />
                <Group Name="p" Success="true"></Group>
            </FileUriStrict>
        </Linux>
        <AuthorityCaseInsensitiveEquals CompareTo="" Returns="true" Description="Empty URI" />
        <AuthorityCaseInsensitiveEquals CompareTo=" " Returns="false" Description="White space" />
    </TestData>
    <TestData Value="^_`jkq{}" Description="Relative single segment path">
        <Windows>
            <FsPathRegex Success="true">
                <Group Name="a" Success="false" />
                <Group Name="h" Success="false" />
                <Group Name="p" Success="true">^_`jkq{}</Group>
            </FsPathRegex>
            <FsPathPattern Success="false" />
            <FormatGuess Success="false" />
            <FileUriStrict Success="false" />
        </Windows>
        <Linux>
            <FsPathRegex Success="true">
                <Group Name="a" Success="false" />
                <Group Name="h" Success="false" />
                <Group Name="p" Success="true">^_`jkq{}</Group>
            </FsPathRegex>
            <FsPathPattern Success="false" />
            <FormatGuess Success="false" />
            <FileUriStrict Success="false" />
        </Linux>
    </TestData>
    <TestData Value="%5E_jkq%7B%7D" Description="Relative single segment URI">
        <Windows>
            <FsPathRegex Success="true">
                <Group Name="a" Success="false" />
                <Group Name="h" Success="false" />
                <Group Name="p" Success="true">%5E_jkq%7B%7D</Group>
            </FsPathRegex>
            <FsPathPattern Success="false" />
            <FormatGuess Success="false" />
            <FileUriStrict Success="true">
                <Group Name="a" Success="false" />
                <Group Name="h" Success="false" />
                <Group Name="p" Success="true">%5E_jkq%7B%7D</Group>
            </FileUriStrict>
        </Windows>
        <Linux>
            <FsPathRegex Success="true">
                <Group Name="a" Success="false" />
                <Group Name="h" Success="false" />
                <Group Name="p" Success="true">%5E_jkq%7B%7D</Group>
            </FsPathRegex>
            <FsPathPattern Success="false" />
            <FormatGuess Success="false" />
            <FileUriStrict Success="true">
                <Group Name="a" Success="false" />
                <Group Name="h" Success="false" />
                <Group Name="p" Success="true">%5E_jkq%7B%7D</Group>
            </FileUriStrict>
        </Linux>
    </TestData>
    <TestData Value="!$'+,@BKQY\" Description="Relative single segment Windows path">
        <Windows>
            <FsPathRegex Success="true">
                <Group Name="a" Success="false" />
                <Group Name="h" Success="false" />
                <Group Name="p" Success="true">!$'+,@BKQY\</Group>
            </FsPathRegex>
            <FsPathPattern Success="false" />
            <FormatGuess Success="false" />
            <FileUriStrict Success="false" />
        </Windows>
        <Linux>
            <FsPathRegex Success="true">
                <Group Name="a" Success="false" />
                <Group Name="h" Success="false" />
                <Group Name="p" Success="true">!$'+,@BKQY\</Group>
            </FsPathRegex>
            <FsPathPattern Success="false" />
            <FormatGuess Success="false" />
            <FileUriStrict Success="false" />
        </Linux>
    </TestData>
    <TestData Value="!$'+,@BKQY/" Description="Relative single segment Linux path">
        <Windows>
            <FsPathRegex Success="true">
                <Group Name="a" Success="false" />
                <Group Name="h" Success="false" />
                <Group Name="p" Success="true">!$'+,@BKQY/</Group>
            </FsPathRegex>
            <FsPathPattern Success="false" />
            <FormatGuess Success="false" />
            <FileUriStrict Success="true">
                <Group Name="a" Success="false" />
                <Group Name="h" Success="false" />
                <Group Name="p" Success="true">!$'+,@BKQY/</Group>
            </FileUriStrict>
        </Windows>
        <Linux>
            <FsPathRegex Success="true">
                <Group Name="a" Success="false" />
                <Group Name="h" Success="false" />
                <Group Name="p" Success="true">!$'+,@BKQY/</Group>
            </FsPathRegex>
            <FsPathPattern Success="false" />
            <FormatGuess Success="false" />
            <FileUriStrict Success="true">
                <Group Name="a" Success="false" />
                <Group Name="h" Success="false" />
                <Group Name="p" Success="true">!$'+,@BKQY/</Group>
            </FileUriStrict>
        </Linux>
    </TestData>
    <TestData Value="AppData\Local\Temp" Description="Relative Nested Windows path">
        <Windows>
            <FsPathRegex Success="true">
                <Group Name="a" Success="false" />
                <Group Name="h" Success="false" />
                <Group Name="p" Success="true">AppData\Local\Temp</Group>
            </FsPathRegex>
            <FsPathPattern Success="false" />
            <FormatGuess Success="false" />
            <FileUriStrict Success="false" />
        </Windows>
        <Linux>
            <FsPathRegex Success="true">
                <Group Name="a" Success="false" />
                <Group Name="h" Success="false" />
                <Group Name="p" Success="true">AppData\Local\Temp</Group>
            </FsPathRegex>
            <FsPathPattern Success="false" />
            <FormatGuess Success="false" />
            <FileUriStrict Success="false" />
        </Linux>
    </TestData>
    <TestData Value="mnt/cdrom files" Description="Relative Nested Linux path">
        <Windows>
            <FsPathRegex Success="true">
                <Group Name="a" Success="false" />
                <Group Name="h" Success="false" />
                <Group Name="p" Success="true">mnt/cdrom files</Group>
            </FsPathRegex>
            <FsPathPattern Success="false" />
            <FormatGuess Success="false" />
            <FileUriStrict Success="false" />
        </Windows>
        <Linux>
            <FsPathRegex Success="true">
                <Group Name="a" Success="false" />
                <Group Name="h" Success="false" />
                <Group Name="p" Success="true">mnt/cdrom files</Group>
            </FsPathRegex>
            <FsPathPattern Success="false" />
            <FormatGuess Success="false" />
            <FileUriStrict Success="false" />
        </Linux>
    </TestData>
    <TestData Value="mnt/cdrom%20files" Description="Relative Nested URI">
        <Windows>
            <FsPathRegex Success="true">
                <Group Name="a" Success="false" />
                <Group Name="h" Success="false" />
                <Group Name="p" Success="true">mnt/cdrom%20files</Group>
            </FsPathRegex>
            <FsPathPattern Success="false" />
            <FormatGuess Success="false" />
            <FileUriStrict Success="true">
                <Group Name="a" Success="false" />
                <Group Name="h" Success="false" />
                <Group Name="p" Success="true">mnt/cdrom%20files</Group>
            </FileUriStrict>
        </Windows>
        <Linux>
            <FsPathRegex Success="true">
                <Group Name="a" Success="false" />
                <Group Name="h" Success="false" />
                <Group Name="p" Success="true">mnt/cdrom%20files</Group>
            </FsPathRegex>
            <FsPathPattern Success="false" />
            <FormatGuess Success="false" />
            <FileUriStrict Success="true">
                <Group Name="a" Success="false" />
                <Group Name="h" Success="false" />
                <Group Name="p" Success="true">mnt/cdrom%20files</Group>
            </FileUriStrict>
        </Linux>
    </TestData>

    <TestData Value="file:///z:/Index%233&amp;4" Description="Windows Drive URL">
        <Windows>
            <FsPathRegex Success="false" />
            <FsPathPattern Success="false" />
            <FormatGuess Success="true">
                <Group Name="f" Success="true">file:///z:/Index%233&amp;4</Group>
                <Group Name="u" Success="false" />
                <Group Name="h" Success="false" />
                <Group Name="p" Success="true">/z:/Index%233&amp;4</Group>
                <Group Name="x" Success="false" />
            </FormatGuess>
            <FileUriStrict Success="true">
                <Group Name="a" Success="true">file:///z:/Index%233&amp;4</Group>
                <Group Name="h" Success="false" />
                <Group Name="p" Success="true">/z:/Index%233&amp;4</Group>
            </FileUriStrict>